{
  "title": "ANZ vs Asia overlay-assisted multi-product wins \u2014 Q1 FY26",
  "requestedBy": "Anza Hashmi",
  "generatedAt": "2026-05-01 11:42 AEST",
  "sources": [
    "Salesforce",
    "BigBrain"
  ],
  "executiveSummary": "ANZ outperformed Asia on overlay-assisted multi-product win volume, while Asia showed higher average ARR per deal.",
  "kpis": [
    {
      "label": "ANZ tagged wins",
      "value": 42,
      "subtext": "Overlay-assisted opps"
    },
    {
      "label": "Asia tagged wins",
      "value": 19,
      "subtext": "Overlay-assisted opps"
    },
    {
      "label": "ANZ ARR",
      "value": 3.8,
      "subtext": "$M total ARR"
    },
    {
      "label": "Asia ARR",
      "value": 2.9,
      "subtext": "$M total ARR"
    }
  ],
  "primaryChart": {
    "title": "Overlay-assisted wins by region",
    "subtitle": "Q1 FY26 opportunity count",
    "type": "bar",
    "datasetLabel": "Tagged wins",
    "items": [
      {
        "label": "ANZ",
        "value": 42
      },
      {
        "label": "Asia",
        "value": 19
      }
    ]
  },
  "secondaryChart": {
    "title": "ARR by product family",
    "subtitle": "$M across tagged multi-product wins",
    "type": "doughnut",
    "datasetLabel": "ARR ($M)",
    "items": [
      {
        "label": "CRM",
        "value": 2.1
      },
      {
        "label": "Service",
        "value": 1.9
      },
      {
        "label": "DEV",
        "value": 1.4
      },
      {
        "label": "Campaigns",
        "value": 1.3
      }
    ]
  },
  "interpretation": "ANZ appears stronger on scaled overlay engagement, with more tagged opportunities and broader coverage. Asia looks more concentrated in fewer, larger motions, which likely explains the stronger average ARR per deal despite lower volume.",
  "notes": [
    "Multi-product includes CRM, Service, DEV, and Campaigns only.",
    "Overlay signal should ideally reflect both overlay field and specialist-request line item.",
    "Figures shown here are mock/example values for the report template scaffold."
  ],
  "detailTable": {
    "columns": [
      "Region",
      "Tagged wins",
      "ARR ($M)",
      "Avg ARR / win ($k)"
    ],
    "rows": [
      [
        "ANZ",
        42,
        3.8,
        90.5
      ],
      [
        "Asia",
        19,
        2.9,
        152.6
      ]
    ]
  }
}